{
  "schema": "https://deepworkplan.com/schema/plan-state/v2.json",
  "plan": "PLAN_lite_fixture",
  "updated_at": "2026-09-11T00:00:00Z",
  "status": "pending",
  "completed_count": 0,
  "task_count": 2,
  "format": "lite",
  "materialization": "ready",
  "promotion": null,
  "tasks": [
    {"id": 1, "locator": {"kind": "inline", "value": "#task-1"}, "title": "Update fixture", "status": "pending", "gates": []},
    {"id": 2, "locator": {"kind": "inline", "value": "#task-2"}, "title": "Final Review", "status": "pending", "gates": []}
  ]
}
